{"artifacts":["sha256:98c68905358d8e21564cf24b71052fec89a4d00b316f41f4160f7d8f4e02a071"],"build_id":"4444444444444444444444444444444444444444444444444444444444444444","coverage":{"claims":"missing","material_items":"complete","material_relations":"missing"},"generation":1,"mappings":[{"claim_fact_id":null,"conflict_fields":[],"evidence_unit_ids":["snapshot-unit:08619a12c4f9c4ebd0512d117117bfdd28bf564726f3ca23014589454abce854","snapshot-unit:a1248ee0cf577235c4c65ccb79e73d6ed007ba2f2718139eb2902323f566a5a7"],"mapping_status":"unlinked","material_item_id":"itm_24db8776cdbe6a1d","rule_version":"cross-role-map-v2"},{"claim_fact_id":null,"conflict_fields":[],"evidence_unit_ids":["snapshot-unit:a1248ee0cf577235c4c65ccb79e73d6ed007ba2f2718139eb2902323f566a5a7","snapshot-unit:fcde8ca3d7be4ac82684e756b72935661253f88a1322a6c983a6800e0f9f9a96"],"mapping_status":"unlinked","material_item_id":"itm_2ecdb456897ce6e2","rule_version":"cross-role-map-v2"},{"claim_fact_id":null,"conflict_fields":[],"evidence_unit_ids":["snapshot-unit:6210e375bc30cce8dfd1d80a8d99c04926dcfcdfda634c16c839e46b700984d2","snapshot-unit:a1248ee0cf577235c4c65ccb79e73d6ed007ba2f2718139eb2902323f566a5a7"],"mapping_status":"unlinked","material_item_id":"itm_6e0bc0c9ca2e6e0d","rule_version":"cross-role-map-v2"},{"claim_fact_id":null,"conflict_fields":[],"evidence_unit_ids":["snapshot-unit:a1248ee0cf577235c4c65ccb79e73d6ed007ba2f2718139eb2902323f566a5a7"],"mapping_status":"unlinked","material_item_id":"itm_7fd68b8c41b260a3","rule_version":"cross-role-map-v2"},{"claim_fact_id":null,"conflict_fields":[],"evidence_unit_ids":["snapshot-unit:4535eac672e32d5b2f23ec469085fbcc35b71456c4afb7ebb5a688c515bbdeab","snapshot-unit:a1248ee0cf577235c4c65ccb79e73d6ed007ba2f2718139eb2902323f566a5a7"],"mapping_status":"unlinked","material_item_id":"itm_9c504433d1c9e5c4","rule_version":"cross-role-map-v2"},{"claim_fact_id":null,"conflict_fields":[],"evidence_unit_ids":["snapshot-unit:743f298d59be33f05420eb5e4f7df90d2d3e067a1443ff4c13c9a2ac60b045e9","snapshot-unit:a1248ee0cf577235c4c65ccb79e73d6ed007ba2f2718139eb2902323f566a5a7"],"mapping_status":"unlinked","material_item_id":"itm_c15af3ca9819ab97","rule_version":"cross-role-map-v2"},{"claim_fact_id":null,"conflict_fields":[],"evidence_unit_ids":["snapshot-unit:8c851e942bbdd9ad9801b75c263ed4e3cab43420e59a00cc7195c4c73bff39bd","snapshot-unit:a1248ee0cf577235c4c65ccb79e73d6ed007ba2f2718139eb2902323f566a5a7"],"mapping_status":"unlinked","material_item_id":"itm_d079b524fc1f3e32","rule_version":"cross-role-map-v2"},{"claim_fact_id":null,"conflict_fields":[],"evidence_unit_ids":["snapshot-unit:11d72264371872514f40d401957b85c555ac714ddacb536bb890c247bcc2d3d7","snapshot-unit:a1248ee0cf577235c4c65ccb79e73d6ed007ba2f2718139eb2902323f566a5a7"],"mapping_status":"unlinked","material_item_id":"itm_d872227e29e5abad","rule_version":"cross-role-map-v2"},{"claim_fact_id":null,"conflict_fields":[],"evidence_unit_ids":["snapshot-unit:a1248ee0cf577235c4c65ccb79e73d6ed007ba2f2718139eb2902323f566a5a7","snapshot-unit:f9188f5fa38e7ebb83cc456203a2e6d8493a675cef576fc9d70dcc59b78ba55c"],"mapping_status":"unlinked","material_item_id":"itm_df336829aa493a6f","rule_version":"cross-role-map-v2"},{"claim_fact_id":null,"conflict_fields":[],"evidence_unit_ids":["snapshot-unit:8f3f778c49fa9b1f36aea3397dca129ffbb0c743e20abdce89d97f6370808349","snapshot-unit:a1248ee0cf577235c4c65ccb79e73d6ed007ba2f2718139eb2902323f566a5a7"],"mapping_status":"unlinked","material_item_id":"itm_fa2f8aa5912a2b8b","rule_version":"cross-role-map-v2"}],"parent_publication_id":null,"publication_id":"sha256:02d3a5dc97d34fc16bb1429082d46ef67fa6a537c498442ee76b1b1743c16326","publication_status":"published","quality_status":"accepted","reason_codes":[],"schema_version":"corpus-semantic-publication-v1","snapshot_id":"sha256:4122c469484f0b50ff13e67548a9ea1f4aba7347ed9f13e93fd92efbc71af2aa","source_id":"3333333333333333333333333333333333333333333333333333333333333333"}